{
  "format": "solution-note",
  "version": "1.0",
  "meta": {
    "title": "A Simple Quadratic Identity",
    "summary": "For every real number \u005C(x\u005C), the quantity \u005C((x-1)^2\u005C) is nonnegative.",
    "author": "",
    "status": "Solved"
  },
  "core": {
    "problem": "Prove that \u005C(x^2-2x+1\u005Cge0\u005C) for every \u005C(x\u005Cin\u005Cmathbb{R}\u005C).",
    "result": {
      "type": "Theorem",
      "statement": "\u005C[\nx^2-2x+1=(x-1)^2\u005Cge0.\n\u005C]",
      "explanation": "The expression is a perfect square and therefore cannot be negative over the real numbers."
    },
    "whyItWorks": [
      {
        "title": "Complete the square",
        "body": "The polynomial factors exactly as \u005C((x-1)^2\u005C)."
      },
      {
        "title": "Squares are nonnegative",
        "body": "For every real \u005C(y\u005C), one has \u005C(y^2\u005Cge0\u005C)."
      }
    ],
    "evidence": "Equality occurs exactly when \u005C(x=1\u005C)."
  }
}
